{
  "$schema": "http://json-schema.org/draft-07/schema#",
  "$id": "https://raw.githubusercontent.com/meta-ai-hackathon/meta-hack/main/kb/schema.json",
  "title": "Benefits Navigator knowledge-base entry",
  "description": "Contract for a versioned, source-linked program entry (BN-04/HACK-29). Every fact a user can see must trace to an official source with a retrieval date, and stale or withdrawn entries must never be cited silently: the consuming API surfaces the entry status alongside any fact it shows.",
  "type": "object",
  "additionalProperties": false,
  "required": ["id", "title", "version", "status", "sources", "facts"],
  "properties": {
    "id": {
      "type": "string",
      "pattern": "^[a-z][a-z0-9_]*$",
      "description": "Snake_case identifier, unique across the knowledge base."
    },
    "title": {
      "type": "string",
      "minLength": 1,
      "description": "Human-readable program name. Carries the {{PILOT_PROGRAM}} placeholder until a pilot is chosen."
    },
    "version": {
      "type": "integer",
      "minimum": 1,
      "description": "Monotonically increasing integer. Bump when any fact or source changes; citations surface the version they came from."
    },
    "status": {
      "enum": ["active", "stale", "withdrawn"],
      "description": "State rules. active: facts re-verified against the sources; citable with status and retrieval date shown. stale: sources may have changed since retrieval; must never be cited silently - any surfaced fact must display the stale status and the status_reason. withdrawn: retracted entirely (program ended, source disowned the facts, or a retraction was found); must never be cited as fact, only presented as withdrawn, and always with the status_reason."
    },
    "status_reason": {
      "type": "string",
      "minLength": 1,
      "description": "Why the entry is stale or withdrawn. Required for stale and withdrawn entries so a non-active citation can always say why."
    },
    "superseded_by": {
      "type": "string",
      "pattern": "^[a-z][a-z0-9_]*$",
      "description": "Id of the entry that replaces this one. Set when a replacement exists."
    },
    "sources": {
      "type": "array",
      "minItems": 1,
      "items": { "$ref": "#/definitions/source" }
    },
    "facts": { "$ref": "#/definitions/facts" }
  },
  "allOf": [
    {
      "if": {
        "properties": { "status": { "enum": ["stale", "withdrawn"] } },
        "required": ["status"]
      },
      "then": { "required": ["status_reason"] }
    }
  ],
  "definitions": {
    "iso_date": {
      "type": "string",
      "pattern": "^\\d{4}-\\d{2}-\\d{2}$",
      "description": "Calendar date the referenced content was retrieved or re-verified (ISO 8601, YYYY-MM-DD). Consumers surface this date with any fact they show."
    },
    "https_url": {
      "type": "string",
      "pattern": "^https://",
      "description": "Official source URL (government or program authority), https only. Placeholders like https://example.org/{{PILOT_PROGRAM}}/rules stand in until a pilot is chosen."
    },
    "source_id": {
      "type": "string",
      "pattern": "^[a-z][a-z0-9_-]*$",
      "description": "Id of one of this entry's sources (cross-checked in code; JSON Schema cannot express the reference)."
    },
    "source": {
      "type": "object",
      "additionalProperties": false,
      "required": ["id", "title", "url", "retrieved_at", "supports"],
      "properties": {
        "id": { "$ref": "#/definitions/source_id" },
        "title": {
          "type": "string",
          "minLength": 1,
          "description": "Human-readable source name."
        },
        "url": { "$ref": "#/definitions/https_url" },
        "retrieved_at": { "$ref": "#/definitions/iso_date" },
        "supports": {
          "type": "string",
          "minLength": 1,
          "description": "What this source supports in the entry."
        }
      }
    },
    "facts": {
      "type": "object",
      "additionalProperties": false,
      "required": ["rules", "required_documents", "official_links", "deadlines"],
      "properties": {
        "rules": { "$ref": "#/definitions/text_fact_group" },
        "required_documents": { "$ref": "#/definitions/text_fact_group" },
        "official_links": { "$ref": "#/definitions/link_fact_group" },
        "deadlines": { "$ref": "#/definitions/deadline_fact_group" },
        "steps": { "$ref": "#/definitions/text_fact_group" },
        "match_signals": { "$ref": "#/definitions/signal_fact_group" },
        "renewal_cadence": { "$ref": "#/definitions/cadence_fact_group" },
        "if_coverage_ends": {
          "$ref": "#/definitions/text_fact_group",
          "description": "Optional group (BN-22 renewal tracker): what the source says happens and what a person can do if their coverage ends, such as the letter, the appeal window, and free help. The tracker shows it, labeled and sourced, once a renewal date has passed."
        }
      }
    },
    "text_fact_group": {
      "type": "object",
      "additionalProperties": false,
      "required": ["items", "source_id", "retrieved_at"],
      "properties": {
        "items": {
          "type": "array",
          "minItems": 1,
          "items": { "type": "string", "minLength": 1 }
        },
        "source_id": { "$ref": "#/definitions/source_id" },
        "retrieved_at": { "$ref": "#/definitions/iso_date" }
      }
    },
    "link_fact_group": {
      "type": "object",
      "additionalProperties": false,
      "required": ["items", "source_id", "retrieved_at"],
      "properties": {
        "items": {
          "type": "array",
          "minItems": 1,
          "items": {
            "type": "object",
            "additionalProperties": false,
            "required": ["label", "url"],
            "properties": {
              "label": { "type": "string", "minLength": 1 },
              "url": { "$ref": "#/definitions/https_url" }
            }
          }
        },
        "source_id": { "$ref": "#/definitions/source_id" },
        "retrieved_at": { "$ref": "#/definitions/iso_date" }
      }
    },
    "deadline_fact_group": {
      "type": "object",
      "additionalProperties": false,
      "required": ["items", "source_id", "retrieved_at"],
      "properties": {
        "items": {
          "type": "array",
          "minItems": 1,
          "items": {
            "type": "object",
            "additionalProperties": false,
            "required": ["label", "due"],
            "properties": {
              "label": { "type": "string", "minLength": 1 },
              "due": {
                "type": "string",
                "minLength": 1,
                "description": "ISO date when fixed; otherwise a statement the listed source supports."
              }
            }
          }
        },
        "source_id": { "$ref": "#/definitions/source_id" },
        "retrieved_at": { "$ref": "#/definitions/iso_date" }
      }
    },
    "signal_fact_group": {
      "type": "object",
      "additionalProperties": false,
      "required": ["items", "source_id", "retrieved_at"],
      "description": "Optional group (mission v2 M3): what this entry's official rules consider about a person, expressed over the generic question spec. Deterministic match scoring consumes these; each carries the program-side reason a card can show, backed by the group's source. Question ids must resolve in specs/question-spec (cross-checked in tests, not here).",
      "properties": {
        "items": {
          "type": "array",
          "minItems": 1,
          "items": {
            "type": "object",
            "additionalProperties": false,
            "required": ["question_id", "reason"],
            "properties": {
              "question_id": {
                "type": "string",
                "pattern": "^[a-z][a-z0-9_]*$",
                "description": "Id of a question in the generic question spec this signal evaluates."
              },
              "values": {
                "type": "array",
                "minItems": 1,
                "items": { "type": "string", "minLength": 1 },
                "description": "Option values the signal matches on. Omitted: any known, non-blank answer matches."
              },
              "weight": {
                "type": "integer",
                "minimum": 1,
                "maximum": 9,
                "description": "How strongly this signal counts toward the entry's score. Default 1."
              },
              "reason": {
                "type": "string",
                "minLength": 1,
                "description": "Program-side claim shown on the match card when the signal matches, backed by the group's source."
              }
            }
          }
        },
        "source_id": { "$ref": "#/definitions/source_id" },
        "retrieved_at": { "$ref": "#/definitions/iso_date" }
      }
    },
    "cadence_fact_group": {
      "type": "object",
      "additionalProperties": false,
      "required": ["items", "source_id", "retrieved_at"],
      "description": "Optional group (BN-22 renewal tracker): how often the program renews coverage, machine-readable so the app can estimate a next renewal date from a date the person reports. Every estimate cites this group's source and is labeled as an estimate, never as an official date. Item ids must be unique within the group (cross-checked in code and tests; JSON Schema cannot express it).",
      "properties": {
        "items": {
          "type": "array",
          "minItems": 1,
          "items": {
            "type": "object",
            "additionalProperties": false,
            "required": ["id", "interval_months", "label", "applies_to"],
            "properties": {
              "id": {
                "type": "string",
                "pattern": "^[a-z][a-z0-9_]*$",
                "description": "Snake_case schedule id, unique within the group."
              },
              "interval_months": {
                "type": "integer",
                "minimum": 1,
                "maximum": 24,
                "description": "Months between renewals under this schedule."
              },
              "label": {
                "type": "string",
                "minLength": 1,
                "description": "The schedule in plain language, as the group's source states it."
              },
              "applies_to": {
                "type": "string",
                "minLength": 1,
                "description": "Who the group's source says this schedule covers, in plain language."
              },
              "starts_on": {
                "$ref": "#/definitions/iso_date",
                "description": "First date a renewal under this schedule can fall on. Omitted: the schedule is already in effect."
              },
              "ages": {
                "type": "object",
                "additionalProperties": false,
                "required": ["min", "max"],
                "description": "The ages the source says this schedule covers, inclusive (min must not exceed max; checked in code). Omitted: the source names no age range. The tracker asks one on-device question about it and leaves the schedule out of the estimates when the answer is outside the range.",
                "properties": {
                  "min": { "type": "integer", "minimum": 0, "maximum": 130 },
                  "max": { "type": "integer", "minimum": 0, "maximum": 130 }
                }
              }
            }
          }
        },
        "source_id": { "$ref": "#/definitions/source_id" },
        "retrieved_at": { "$ref": "#/definitions/iso_date" }
      }
    }
  }
}
