{
  "id": "pilot_program_sample",
  "title": "{{PILOT_PROGRAM}} (sample knowledge-base entry)",
  "version": 2,
  "status": "active",
  "sources": [
    {
      "id": "official_rules_source",
      "title": "{{PILOT_PROGRAM}} official rules page",
      "url": "https://example.org/{{PILOT_PROGRAM}}/rules",
      "retrieved_at": "2026-10-29",
      "supports": "Program rules, required documents, steps, and deadlines stated in this entry."
    },
    {
      "id": "official_application_portal",
      "title": "{{PILOT_PROGRAM}} official application portal",
      "url": "https://example.org/{{PILOT_PROGRAM}}/apply",
      "retrieved_at": "2026-10-29",
      "supports": "The official application link listed in the official_links fact group."
    }
  ],
  "facts": {
    "rules": {
      "items": [
        "Eligibility for {{PILOT_PROGRAM}} is decided solely by the program's official rules, never by this app.",
        "{{PILOT_PROGRAM}} can change its rules at any time; every fact must be re-verified against the source and retrieval date listed for its group.",
        "Applicants must satisfy the residency and income rules stated in the official rules source for this entry."
      ],
      "source_id": "official_rules_source",
      "retrieved_at": "2026-10-29"
    },
    "required_documents": {
      "items": [
        "Identity document accepted by {{PILOT_PROGRAM}} (placeholder - the official source lists the accepted documents).",
        "Residency document accepted by {{PILOT_PROGRAM}} (placeholder - the official source lists the accepted documents)."
      ],
      "source_id": "official_rules_source",
      "retrieved_at": "2026-10-29"
    },
    "official_links": {
      "items": [
        {
          "label": "{{PILOT_PROGRAM}} application portal",
          "url": "https://example.org/{{PILOT_PROGRAM}}/apply"
        }
      ],
      "source_id": "official_application_portal",
      "retrieved_at": "2026-10-29"
    },
    "deadlines": {
      "items": [
        {
          "label": "{{PILOT_PROGRAM}} application window",
          "due": "Published by the official source - placeholder until a pilot program is chosen"
        },
        {
          "label": "Renewal: the program re-verifies your facts on a schedule the official rules set",
          "due": "Published by the official source - placeholder until a pilot program is chosen"
        }
      ],
      "source_id": "official_rules_source",
      "retrieved_at": "2026-10-29"
    },
    "steps": {
      "items": [
        "Gather the documents the official rules list as required.",
        "Start the application through the official application portal.",
        "Attend any appointment the program schedules with you."
      ],
      "source_id": "official_rules_source",
      "retrieved_at": "2026-10-29"
    },
    "match_signals": {
      "items": [
        {
          "question_id": "housing_status",
          "values": ["shelter", "car", "outdoors", "nowhere"],
          "weight": 3,
          "reason": "The program's rules give priority to people without a stable place to sleep."
        },
        {
          "question_id": "id_status",
          "values": ["need_id", "id_in_progress"],
          "weight": 2,
          "reason": "The program's rules cover people who are obtaining or replacing an identity document."
        },
        {
          "question_id": "income_sources",
          "values": ["none"],
          "weight": 2,
          "reason": "The program's income rules consider households with no money coming in right now."
        }
      ],
      "source_id": "official_rules_source",
      "retrieved_at": "2026-10-29"
    }
  }
}
